post_id,owner_id,PostEngagement,Content,Comments,Male,Female,Age,Electronics_Gadgets,Furniture,Outdoor_Gear,Beauty_Products,Accessories
840001,840001,389.0,"Xiaomi 14T Pro

เพิ่งได้ลองเจ้า Xiaomi 14T Pro มาไม่นาน อยากจะมาเล่าประสบการณ์ส่วนตัวให้ฟังเลยนะ! ตอนแรกที่ได้เครื่องมาคือว้าวกับจอมาก AMOLED 6.67 นิ้ว ใหญ่สะใจ แถมยังสว่างเว่อร์ 4,000 นิต! คือออกแดดจ้าๆ ก็ยังมองเห็นชัดแจ๋ว ไม่ต้องเพ่งเลย อันนี้ประทับใจสุดๆ

ส่วนเรื่องกล้อง... ปกติก็ไม่ได้เป็นคนถ่ายรูปเก่งอะไรนะคะ แต่พอใช้ตัวนี้รู้สึกว่ารูปสวยขึ้นเยอะเลย กล้องหลัง 3 ตัวนี่เก็บรายละเอียดดีมาก โดยเฉพาะกล้องเทเลโฟโตซูมได้ไกลดีงาม ส่วนกล้องหน้า 32MP ก็เซลฟี่สวยอยู่

ที่เซอร์ไพรส์คือมีฟีเจอร์ AI มาให้เล่นเยอะมาก ทั้ง Circle to Search, สรุปโน้ต, แปลภาษา คือมันช่วยให้ชีวิตง่ายขึ้นเยอะเลย ไม่ต้องมานั่งงมเอง ใครสายเทคฯ น่าจะชอบเลย เพราะมันมีอะไรให้เล่นเยอะจริงๆ

โดยรวมคือคุ้มค่ากับราคานะ ถ้าใครมองหาสมาร์ทโฟนที่จอสวย กล้องดี มี AI ช่วยทำงานได้หลากหลาย ก็แนะนำเลย แต่ถ้าไม่ได้ใช้ฟีเจอร์ AI เยอะๆ อาจจะรู้สึกว่ามันเกินความจำเป็นไปหน่อย แต่สำหรับประสบการณ์ที่ได้รับคือแฮปปี้มาก",Nice design; wow,1,0,21,1,0,0,0,0
1290002,780010,41.5,"Samsung Galaxy Watch Ultra

เป็นสายเทคฯ ที่ชอบนาฬิกาดีไซน์สวยๆ อยู่แล้ว พอเจอ Galaxy Watch Ultra นี่คือใจละลายเลย! วัสดุพรีเมี่ยมสุดๆ ใส่แล้วดูดีมีระดับจริงๆ นะ ไม่ว่าจะแต่งตัวลุคไหนก็เข้าหมดเลย

เรื่องฟีเจอร์สุขภาพก็คือครบครันมาก เช็คหัวใจ เช็คการนอนได้ง่ายๆ แค่อยู่บนข้อมือ ซึ่งช่วยให้ติดตามสุขภาพตัวเองตลอดเวลาเลย สะดวกมาก และยิ่งมี AI เข้ามาช่วยยิ่งรู้สึกว่าชีวิตง่ายขึ้นเยอะ บางทีก็รู้สึกเหมือนมีผู้ช่วยส่วนตัวมาอยู่บนข้อมือเลย

ส่วนตัวคิดว่าเหมาะกับคนที่ไม่ชอบพกมือถือเยอะๆ แต่อยากให้ทุกอย่างอยู่ใกล้ตัว เพราะมันแทบจะเป็นมือถือเครื่องที่สองได้เลยจริงๆ ใครที่กำลังมองหาสมาร์ทวอทช์ที่ครบเครื่องทั้งดีไซน์และฟังก์ชัน แนะนำตัวนี้เลย อาจจะราคาสูงหน่อย แต่คุณภาพสมราคาจริงๆ",good,0,1,21,1,0,0,0,0
1320002,1140001,129.0,"Lenovo LOQ 15APH8-82XT004FTA

ใครสายเกมเมอร์หรือทำงานกราฟิก Lenovo LOQ 15APH8-82XT004FTA ตัวนี้คือต้องมี! คือมันเร็วจี๋แบบไม่น่าเชื่อเลย การ์ดจอ NVIDIA GeForce RTX Series กับ CPU AMD Ryzen 7000 Series คือทำงานร่วมกันได้ดีมาก ลื่นไหลแบบไม่มีสะดุดเลย

ลองเอามาเล่นเกมกราฟิกหนักๆ คือภาพสวยคมชัด เฟรมเรตดีงาม ไม่มีกระตุกเลย ส่วนเรื่องพิมพ์งานก็คือฟินมาก คีย์บอร์ดของ Lenovo นี่มันดีจริงๆ นะ พิมพ์แล้วรู้สึกคล่องตัวสุดๆ

ตัวเครื่องก็ไม่ได้ใหญ่เทอะทะอย่างที่คิด พกพาสะดวกกว่ารุ่นเก่าๆ เยอะเลย วัสดุดูทนทานดีด้วยนะ คือเขาออกแบบมาให้เรียบง่ายแต่ใช้งานได้จริง

โดยรวมคือประทับใจมาก ถ้าใครกำลังหาโน้ตบุ๊กคู่ใจสำหรับเล่นเกมหรือทำงานหนักๆ แนะนำตัวนี้เลย คุ้มค่าทุกบาททุกสตางค์ที่จ่ายไปจริงๆ!",kk; earthsrichok@gmail.com,1,0,21,1,0,0,0,0
1380005,780010,25.0,"MSI Thin 15 B12UCX-1428TH Cosmos

เจอแล้วเพื่อนร่วมทางที่ใช่! MSI Thin 15 B12UCX-1428TH Cosmos ตัวนี้คือพกไปไหนก็สะดวกมากจริงๆ น้ำหนักเบาดีไซน์บาง เหมาะกับคนที่ไม่ชอบแบกของหนักๆ เลย

เรื่องเล่นเกมก็ไม่ทำให้ผิดหวังนะ ถึงจะบอกว่า Thin แต่พลังไม่ Thin ตามชื่อเลย การ์ดจอ NVIDIA GeForce RTX 2050 คือเอาอยู่ เล่นเกมที่ไม่ได้กินสเปกโหดมากคือลื่นไหลเลย แถม CPU Intel Core i5 ก็คือทำงานทั่วไปได้สบายๆ เลย

ยอมรับว่าตอนแรกก็แอบลังเลนะ แต่พอได้ใช้จริงแล้วรู้สึกว่าคุ้มค่าเกินราคามากๆ สำหรับใครที่มองหาโน้ตบุ๊กเกมมิ่งที่เน้นความคล่องตัว พกพาง่าย แต่ยังเล่นเกมได้ดี แนะนำตัวนี้เลย! เป็นเพื่อนที่สมบูรณ์แบบจริงๆ",,0,1,21,1,0,0,0,0
1380008,1200001,126.0,"Notebook Lenovo IdeaPad Slim 5 Light 14ABR 82XS003BTA (Cloud Grey)

โอ้ย! โน้ตบุ๊กเครื่องนี้คือดีงามพระรามแปด! Lenovo IdeaPad Slim 5 Light เนี่ยตอบโจทย์คนทำงานสุดๆ เลย ด้วยความที่เป็นคนใช้ทำงานเอกสาร ดูหนัง ฟังเพลง แล้วก็ไถโซเชียลเป็นหลัก ตัวนี้คือครบจบในเครื่องเดียวจริงๆ

หน้าจอ FHD IPS สีสวยคมชัด ดู Netflix คือเพลินมาก CPU AMD Ryzen 7 ก็คือแรงพอตัว เปิดหลายโปรแกรมพร้อมกันก็ยังลื่นไหลไม่สะดุดเลย แถมมี Microsoft Office Home & Student 2021 มาให้ในเครื่องด้วย ไม่ต้องไปหาลงเองอีก สะดวกสุดๆ

ที่สำคัญคือน้ำหนักเบา! พกไปไหนมาไหนสบายมาก แบกใส่กระเป๋าไปทำงานข้างนอกก็ไม่ปวดไหล่เลย อันนี้เป็นสิ่งที่ประทับใจที่สุดเลย

ถ้าใครกำลังมองหาโน้ตบุ๊กทำงานเบาๆ ที่พกพาง่าย ประสิทธิภาพดี ฟังก์ชันครบครัน แนะนำตัวนี้เลย ไม่ผิดหวังแน่นอน!",earthsrichok@gmail.com; kxtyqh; akqndp; vijomc; mpeits,1,0,32,1,0,0,0,0
1380010,1200001,102.0,"MSI Raider GE78 HX 14VHG-605TH Black

โอ้โห! MSI Raider GE78 HX 14VHG-605TH Black ตัวนี้คือสัตว์ประหลาดของจริงงงง! สายเกมเมอร์ตัวจริงต้องร้องกรี๊ดดดดด

บอกเลยว่าสเปกจัดเต็มแบบไม่เกรงใจใครเลย CPU Intel Core i9-14900HX นี่คือแรงแบบมหาศาลจริงๆ เล่นเกมหนักแค่ไหนก็คือลื่นปรื๊ดๆ กราฟิก NVIDIA GeForce RTX 4080 ก็คือภาพสวยจนแทบอยากจะกระโดดเข้าไปอยู่ในเกมเลย

ลองเอามาเล่นเกมที่กินสเปกเยอะๆ ปรับสุดหมดก็คือไม่มีกระตุกเลยแม้แต่นิดเดียว! แถมเรื่องการทำงานก็คือไม่ต้องพูดถึง เร็วแบบจรวด จะเรนเดอร์งานกราฟิก หรือตัดต่อวิดีโอก็คือสบายมาก

แต่แน่นอนว่าของดีก็ต้องมีราคาที่แรงตามไปด้วยนะ ฮ่าๆ แต่ถ้าใครงบถึงและต้องการโน้ตบุ๊กที่พร้อมลุยทุกสนามรบ ไม่ว่าจะเล่นเกมหรือทำงานหนักๆ ตัวนี้คือตอบโจทย์ทุกความต้องการจริงๆ ไม่ผิดหวังแน่นอน!",Good; earthsrichok@gmail.com,1,0,32,1,0,0,0,0
1380011,1200001,71.5,"MSI Prestige 16 AI Studio B1VFG-094TH Stellar Gray

สำหรับสายทำงานสร้างสรรค์ หรือคนทำงานที่ต้องการประสิทธิภาพแบบจัดเต็ม ขอแนะนำ MSI Prestige 16 AI Studio B1VFG-094TH ตัวนี้เลย! คือมันดีงามจริงๆ

ด้วย Intel Core Ultra ที่มาพร้อม AI เนี่ย มันทำให้การทำงานมันง่ายขึ้นเยอะ ไม่ว่าจะตัดต่อวิดีโอ เรนเดอร์ภาพ หรือแม้แต่งานกราฟิกที่ซับซ้อน ก็คือลื่นไหลแบบสุดๆ ไม่มีสะดุดเลย การ์ดจอ NVIDIA GeForce RTX 4060 ก็ช่วยให้งานกราฟิกดูดีมีชีวิตชีวาขึ้นไปอีก

ดีไซน์ก็สวยหรูดูแพง สี Stellar Gray คือดูมินิมอลแต่มีระดับมากๆ พกไปทำงานที่ไหนก็ดูดีไปหมด

ข้อดีคือประสิทธิภาพจัดเต็มเรื่อง AI และงานกราฟิก ส่วนข้อสังเกตคือด้วยสเปกขนาดนี้ก็อาจจะมาพร้อมราคาที่ต้องคิดหนักนิดนึง แต่ถ้าเทียบกับประสิทธิภาพที่ได้คือคุ้มค่าทุกบาททุกสตางค์จริงๆ",,1,0,32,1,0,0,0,0
1380018,1110001,42.0,"AULA F75 GASKET MECHANICAL KEYBOARD

กรี๊ดดดดด! ต้องรีวิวคีย์บอร์ด AULA F75 GASKET MECHANICAL KEYBOARD ตัวนี้เลยค่ะทุกคนนนน! บอกเลยว่าโดนตกไปเต็มๆ ตั้งแต่ครั้งแรกที่ได้ลองเลย

ปกติเป็นคนใช้คีย์บอร์ดหนักมาก ทั้งเล่นเกม พิมพ์งาน แล้วตัวนี้คือตอบโจทย์สุดๆ ด้วย Gasket Structure ที่ทำให้เสียงกดมันแน่นๆ หนึบๆ ฟินหูมากค่ะ ไม่ได้เสียงก้องแก้งเหมือนคีย์บอร์ดทั่วไปเลย แถม Hot-swappable ได้ด้วยนะ ใครอยากเปลี่ยนสวิตช์ก็ทำได้ง่ายๆ เลย

ที่สำคัญคือเชื่อมต่อได้ 3 โหมด! ทั้ง Type-C, Wireless 2.4G, และ Bluetooth คือสะดวกสุดๆ อยากจะใช้กับอะไรก็ทำได้หมดเลย ไม่ต้องหงุดหงิดเรื่องสายพันกันอีกต่อไป

แล้วไฟ RGB 16.8 ล้านสีนี่คือสวยตาแตกมาก! มีโหมดไฟให้เล่นเยอะแยะเลย ยิ่งมี Music rhythm ด้วยนะ คือแบบว้าววว! แบตเตอรี่ก็อึดใช้ได้นานเลยค่ะ ไม่ต้องชาร์จบ่อยๆ

ใครกำลังตามหาคีย์บอร์ดดีๆ ที่ทั้งสวย เสียงดี ฟังก์ชันครบ และใช้ได้ทั้งเล่นเกมทำงาน บอกเลยว่าตัวนี้คือห้ามพลาด! แนะนำสุดใจขาดดิ้นเลย!",ราคาดีจัดๆ; สุดตึง ฮะพี่,1,0,21,1,0,0,0,0
1380021,1260003,122.0,"Review iPhone 16 ProMax

มาแล้วจ้าาา! หลังจากรอคอยมานานในที่สุดก็ได้ลองจับ iPhone 16 Pro Max สี Desert ที่ทุกคนฮือฮากันสักที!

บอกตรงๆ ว่าตอนแรกก็ไม่ได้คาดหวังอะไรมากนะ เพราะคิดว่า iPhone ก็คือ iPhone แต่พอได้ใช้จริงเท่านั้นแหละ... ยอมรับเลยว่าสีใหม่มันสวยสะกดใจจริงๆ ค่ะ ดูหรูหรามากๆ ส่วนเรื่องประสิทธิภาพคงไม่ต้องพูดถึง เพราะมันเร็ว แรง ลื่นปรื๊ดตามสไตล์ Apple อยู่แล้ว ไม่มีสะดุดเลยสักนิด

กล้องก็คือดีงามตามท้องเรื่อง ถ่ายรูปออกมาสวยคมชัดทุกช็อต ไม่ว่าจะแสงน้อยแสงมากก็เอาอยู่หมดเลย ถ่ายวิดีโอก็คือสมูทมาก

โดยรวมคือแฮปปี้มาก! สำหรับใครที่เป็นสาวก Apple หรือกำลังมองหาสมาร์ทโฟนตัวท็อปที่เน้นดีไซน์สวยหรู ประสิทธิภาพสูง กล้องเทพๆ ตัวนี้คือคำตอบเลยค่ะ แต่อาจจะต้องเตรียมงบเยอะหน่อยนะ เพราะราคาก็เอาเรื่องอยู่เหมือนกัน ????",nice; gooood; อยากได้; โครตลั่นอะ,0,1,24,1,0,0,0,0
1380031,1260005,118.0,"Football Shirt (Liverpool shirt)

ในฐานะแฟนหงส์แดงตัวยง ต้องขอรีวิว Premium Custom Football Shirt (Liverpool shirt) ตัวนี้เลย! บอกเลยว่าเสื้อทีมรักเนี่ยมันไม่ใช่แค่เสื้อ แต่มันคือจิตวิญญาณ!

เนื้อผ้าดีมาก ใส่สบายสุดๆ ไม่ร้อนเลย ระบายอากาศได้ดีเยี่ยม จะใส่เชียร์บอลอยู่บ้าน หรือใส่ไปเตะบอลกับเพื่อนก็คือเอาอยู่หมดเลย ดีไซน์ก็คือสวยงามตามแบบฉบับลิเวอร์พูลเลย ยิ่งเป็น Custom ด้วยแล้ว มันให้ความรู้สึกเป็นของตัวเองมากๆ เลยค่ะ

ข้อดีคือใส่แล้วภูมิใจในทีมรักสุดๆ ไปไหนมาไหนคนก็รู้ว่าเชียร์ทีมไหน ส่วนข้อเสีย... ไม่มีข้อเสียเลยค่ะ! สำหรับแฟนบอล เสื้อบอลนี่คือ Must-have จริงๆ ค่ะ! ใครที่เป็นแฟนลิเวอร์พูลเหมือนกัน ต้องมีไว้ในครอบครองนะคะ! YNWA! ⚽️",⭐️⭐️⭐️; แพงจังครับ; แชมป์ตลอดกาล; Champ ดิวะ,1,0,21,0,0,0,0,1
1380032,1260010,3.0,"สายชาร์ต Micro USB สีเทา

ขอรีวิวสายชาร์จ! หลายคนอาจจะคิดว่าสายชาร์จธรรมดาๆ จะมีอะไรให้รีวิวใช่ไหม? แต่สำหรับสายชาร์จดีๆ ก็สำคัญไม่แพ้กันเลยนะ

เจ้าสายชาร์ต Micro USB สีเทา เส้นนี้คือทนทานเกินคาดมากๆ เลย ปกติสายชาร์จจะขาดง่ายมาก แต่เส้นนี้ใช้มานานแล้วยังไม่มีงอแงเลยค่ะ วัสดุดูแข็งแรงดี ไม่ใช่พลาสติกก๊องแก๊งเหมือนบางยี่ห้อ

เรื่องชาร์จก็คือชาร์จเข้าปกตินะ ไม่ได้เร็วเว่อร์วังอะไร แต่ก็ไม่ช้าจนน่าหงุดหงิดเลย ความยาวก็กำลังดี ไม่สั้นไม่ยาวเกินไป พกพาสะดวกดี

ข้อดีคือความทนทาน และราคาที่น่าคบหาค่ะ ส่วนข้อเสีย... ก็คือมันเป็น Micro USB ซึ่งตอนนี้อาจจะไม่ค่อยนิยมเท่า Type-C แล้ว แต่ถ้าใครยังใช้อุปกรณ์ที่เป็น Micro USB อยู่ แนะนำเส้นนี้เลย! ของดีบอกต่อ!",,0,1,20,1,0,0,0,0
1380033,1260011,6.0,"PS5

ในที่สุดก็ได้มาครอบครองงงง! PS5 ของเรา! คือไม่พูดเยอะเจ็บคอ บอกเลยว่าเกมเมอร์อย่างเราไม่มีไม่ได้จริงๆ!

ตอนแรกก็คิดหนักอยู่ค่ะว่าจะซื้อดีไหม เพราะราคาก็ไม่ใช่เล่นๆ แต่พอได้ลองเล่นเกมที่กราฟิกเทพๆ บน PS5 เท่านั้นแหละ! ภาพสวยคมชัดจนขนลุก โหลดเกมก็เร็วมากกกกก ไม่ต้องรอจนหลับเหมือนสมัยก่อนแล้ว

จอย DualSense ก็คือดีงามพระเก้า มีระบบสั่น Haptic Feedback ที่ทำให้เราอินไปกับเกมมากขึ้นจริงๆ ยิงปืนก็รู้สึกเหมือนยิงจริง วิ่งในป่าก็รู้สึกถึงกิ่งไม้ นี่แหละคือประสบการณ์การเล่นเกมที่สมจริง!

ข้อดีคือประสิทธิภาพสุดยอด เกม Exclusive ก็คือปังมาก ส่วนข้อเสียก็คือ... กระเป๋าตังค์เบาหวิวไปเลยค่ะ ???? แต่บอกเลยว่าคุ้มค่าทุกบาททุกสตางค์ที่เสียไป! ใครที่รักการเล่นเกมคือต้องจัดเลยนะ!",,1,0,20,1,0,0,0,0
1380053,1260018,62.0,"Asus Tuf Gamming F15 FX507ZC4-HN060W

สวัสดี! วันนี้จะมารีวิวโน้ตบุ๊กคู่ใจสำหรับเกมเมอร์อย่างเรา นั่นก็คือ Asus Tuf Gamming F15 FX507ZC4-HN060W นั่นเอง!

บอกเลยว่าเจ้าตัวนี้มันเกิดมาเพื่อการเล่นเกมจริงๆ ค่ะ! ด้วยโปรเซสเซอร์ Intel Core และชิปกราฟิก GeForce GTX นี่คือเล่นเกมลื่นปรื๊ดๆ แบบไม่มีกระตุกเลย ภาพบนจอ IPS 144Hz ก็คือนุ่มนวลสบายตามาก ทำให้เราอินไปกับเกมได้เต็มที่เลย

ที่ชอบอีกอย่างคือเรื่องความทนทาน! ชื่อก็บอกอยู่แล้วว่า TUF คือมันแกร่งจริง พกไปไหนมาไหนไม่ต้องกลัวเลยว่าจะพังง่ายๆ ขนาดก็เล็กและเบาลงกว่ารุ่นก่อนๆ ด้วยนะ แบตก็อึดใช้ได้นานเลยค่ะ

ข้อดีคือแรง ทนทาน เล่นเกมได้ดีเยี่ยม แถมระบายความร้อนก็ดีด้วย ส่วนข้อเสีย... ยังไม่เจอข้อเสียที่ชัดเจนเลย! ถ้าคุณเป็นเกมเมอร์ที่ต้องการโน้ตบุ๊กที่ไว้ใจได้ ลุยได้ทุกที่ทุกสถานการณ์ แนะนำตัวนี้เลย!",wifi ไม่ค่อยดีรุ่นนี้; ไปเอารุ่นใหม่ดีกว่าแก้แล้ว,0,1,24,1,0,0,0,0
