post_id,owner_id,PostEngagement,Content,Comments,Male,Female,Age,Electronics_Gadgets,Furniture,Outdoor_Gear,Beauty_Products,Accessories
1380067,1260018,0.0,"ลำโพงบลูทูธ JBL Party Box Stage 320 White

สายปาร์ตี้ตัวจริงต้องห้ามพลาด! ลำโพงบลูทูธ JBL Party Box Stage 320 White ตัวนี้คือที่สุดของความมันส์จริงๆ!

เพิ่งได้ลองใช้ในงานเลี้ยงที่บ้าน บอกเลยว่าเสียงกระหึ่มมากกกก! เบสแน่นตึ้บจนพื้นสะเทือน วูฟเฟอร์ high-sensitivity สองตัวนี่คือให้เสียงดีเกินคาดจริงๆ เปิดเพลงแดนซ์คือโยกกันมันส์สุดๆ

ที่ชอบคือมีฟังก์ชัน AI Sound Boost ด้วย คือมันวิเคราะห์เสียงแบบเรียลไทม์ ทำให้เสียงออกมาดีที่สุดตลอดเวลาเลย แถมยังกันน้ำได้ด้วยนะ! พกไปปาร์ตี้ริมสระน้ำก็คือสบายมากไม่ต้องกลัวพังเลย

แบตเตอรี่ก็อึดสุดๆ เปิดเพลงได้ยาวนานตลอดทั้งคืน ไม่ต้องกลัวแบตหมดกลางคันเลย

ข้อดีคือเสียงทรงพลัง กันน้ำ แบตอึด เหมาะกับสายปาร์ตี้มากๆ ส่วนข้อเสีย... น้ำหนักอาจจะเยอะไปหน่อย พกพายากนิดนึง แต่ถ้าเทียบกับความมันส์ที่ได้คือคุ้มค่ามากๆ เลย!",,0,1,24,1,0,0,0,0
1380068,1260018,10.0,"Computer Set - AMD VALUE SET1 (R5 5600GT | RAM16GB/3200 | SSD250GB)

สวัสดีทุกคน! วันนี้จะมารีวิวคอมเซ็ตสุดคุ้ม! Computer Set - AMD VALUE SET1 ตัวนี้เลย!

ในฐานะที่ไม่ได้เป็นเกมเมอร์ฮาร์ดคอร์อะไรมาก แต่ก็อยากได้คอมที่ทำงานได้สบายๆ ดูหนังฟังเพลงลื่นๆ เล่นเกมเบาๆ ได้บ้าง ตัวนี้คือตอบโจทย์มากๆ เลย

ซีพียู AMD Ryzen 5 ที่มีกราฟฟิกในตัวคือดีงามมาก ไม่ต้องซื้อการ์ดจอแยกก็ยังทำงานได้ดีเลย แรม 16GB ก็คือพอสำหรับการทำงานทั่วไป เปิดหลายโปรแกรมพร้อมกันก็ยังลื่นไหลอยู่ SSD 250GB ก็คือโหลดวินโดวส์เร็ว เปิดเครื่องแป๊บเดียวก็พร้อมใช้งานแล้วค่ะ

ข้อดีคือราคาคุ้มค่ามาก ทำงานทั่วไปได้ดี เล่นเกมไม่หนักมากได้สบายๆ ส่วนข้อเสีย... ถ้าใครเป็นเกมเมอร์สายฮาร์ดคอร์ที่ต้องการเล่นเกมกราฟิกหนักๆ อาจจะต้องมองข้ามไปหน่อย แต่โดยรวมแล้วสำหรับคนที่ต้องการคอมพิวเตอร์สำหรับการใช้งานในชีวิตประจำวัน แนะนำตัวนี้เลย!",,0,1,24,1,0,0,0,0
1380069,1260018,5.0,"Computer Set - MSI COM EXPO SET4 (R5 4500 | RAM16GB/3200 | SSD 256GB | RTX3050)

วันนี้จะมารีวิวคอมเซ็ตที่มองว่าคุ้มค่าเกินราคามากๆ นั่นก็คือ Computer Set - MSI COM EXPO SET4 ตัวนี้เลย!

ยอมรับเลยว่าตอนแรกที่เห็นสเปกก็แอบว้าวแล้วนะ พอได้มาลองใช้จริงคือมันดีกว่าที่คิดอีกค่ะ! CPU AMD Ryzen 5 ทำงานร่วมกับการ์ดจอ MSI RTX 3050 เนี่ยคือเข้ากันได้ดีมาก ทำให้เล่นเกมระดับกลางๆ ได้สบายๆ เลย ภาพสวย ลื่นไหล ไม่มีสะดุด

แรม 16GB ก็คือพอสำหรับการทำงานทั่วไป เปิดหลายแท็บในเบราว์เซอร์ก็ยังลื่นไหลอยู่ SSD 256GB ก็ทำให้โหลดโปรแกรมเร็วขึ้นเยอะเลย

ข้อดีคือราคาดีมาก ได้การ์ดจอแยก เล่นเกมระดับกลางได้ดี ทำงานทั่วไปได้สบายๆ ส่วนข้อเสีย... ถ้าใครอยากเล่นเกมกราฟิกหนักๆ แบบปรับสุด อาจจะต้องอัปเกรดการ์ดจอเพิ่ม แต่โดยรวมแล้วสำหรับราคาเท่านี้ ถือว่ามันคุ้มค่ามากๆ เลย! เหมาะกับคนที่ต้องการคอมพิวเตอร์ที่ใช้งานได้หลากหลาย ไม่ว่าจะทำงานหรือเล่นเกม!",,0,1,24,1,0,0,0,0
1380070,1260018,0.0,"สมาร์ทวอทช์ Samsung Galaxy Fit3 Pink Gold

วันนี้จะมารีวิวสมาร์ทวอทช์สีชมพูสุดน่ารัก! Samsung Galaxy Fit3 Pink Gold ตัวนี้เลย! ใครสายสุขภาพหรือชอบออกกำลังกายต้องโดน!

บอกเลยว่าชอบดีไซน์มากๆ เลย สี Pink Gold คือสวยหวานมาก ใส่แล้วดูดีสุดๆ หน้าจอ 1.6 นิ้วก็ใหญ่กำลังดี มองเห็นข้อมูลได้ชัดเจน น้ำหนักเบามาก ใส่แล้วไม่รู้สึกเกะกะเลย

ฟังก์ชันสุขภาพก็คือครบครันสุดๆ ติดตามการนอน การเต้นของหัวใจ โหมดออกกำลังกายก็มีให้เลือกเป็นร้อยแบบเลย! ไม่ว่าจะวิ่ง โยคะ หรือปั่นจักรยานก็คือเก็บข้อมูลได้หมดเลย แบตเตอรี่ก็อึดมาก ใช้ได้ตลอดทั้งวันสบายๆ เลย

ข้อดีคือดีไซน์สวย ฟังก์ชันสุขภาพแน่น แบตอึด น้ำหนักเบา ส่วนข้อเสีย... สำหรับคนที่ต้องการสมาร์ทวอทช์ที่โทรออกรับสายได้โดยตรงอาจจะต้องมองรุ่นอื่น แต่โดยรวมแล้วสำหรับราคาเท่านี้ ถือว่าคุ้มค่ามากๆ เลย! แนะนำเลย!",,0,1,24,1,0,0,0,0
1380071,1260005,5.0,"ROG Labtop For YOU! (ROG)

โอ้ยยยย! ในที่สุดก็ได้มาลองเจ้า ROG Labtop For YOU! ตัวนี้แล้ว! บอกเลยว่าสมคำร่ำลือจริงๆ นะ นี่แหละโน้ตบุ๊กที่เกมเมอร์ทุกคนใฝ่ฝัน!

ในฐานะเกมเมอร์ตัวยง บอกเลยว่าประสิทธิภาพของ ROG นี่คือสุดยอดมาก! เล่นเกมกราฟิกหนักแค่ไหนก็คือลื่นปรื๊ดๆ ไม่มีกระตุกเลย ภาพสวยคมชัดจนแทบจะทะลุจอออกมาเลย การตอบสนองของเครื่องก็คือเร็วมาก เปิดปิดโปรแกรม เปิดเกมคือไวสุดๆ

ดีไซน์ก็คือเท่บาดใจ มีความเป็นเกมเมอร์สูงมาก ไฟ RGB ก็คือสวยงามอลังการสุดๆ ไปเลย

ข้อดีคือแรงเหลือเฟือ เล่นเกมได้สุดยอด ดีไซน์เท่ ส่วนข้อเสีย... ก็คือราคานี่แหละที่อาจจะทำให้หลายคนต้องคิดหนัก แต่ถ้าคุณจริงจังกับการเล่นเกมและต้องการประสบการณ์ที่ดีที่สุด แนะนำตัวนี้เลย! ไม่มีคำว่าผิดหวัง!",,1,0,21,1,0,0,0,0
1380072,1260001,0.0,"รีวิวโต๊ะทำงานอเนกประสงค์ พับเก็บได้ ประหยัดพื้นที่สุดๆ

สำหรับคนอยู่คอนโดหรือห้องเล็กๆ แบบเรา โต๊ะทำงานตัวนี้คือตอบโจทย์ชีวิตสุดๆ เลย! เป็นโต๊ะพับได้ที่ออกแบบมาดีมาก คือใช้งานสะดวกมาก จะกางออกเป็นโต๊ะทำงานใหญ่ๆ ก็ได้ พอไม่ใช้ก็พับเก็บได้เรียบสนิทแนบผนังไปเลย คือประหยัดพื้นที่ไปได้เยอะมากๆ

วัสดุก็แข็งแรงทนทานดีนะ ไม่ก๊องแก๊งอย่างที่คิด แถมดีไซน์ก็มินิมอลเข้ากับห้องได้ง่าย

ข้อดีคือประหยัดพื้นที่สุดๆ แข็งแรง ทนทาน และใช้งานง่ายมาก เหมาะกับไลฟ์สไตล์คนเมืองที่ต้องการความยืดหยุ่น ส่วนข้อเสียอาจจะเป็นเรื่องราคาที่สูงกว่าโต๊ะปกติไปหน่อย แต่ถ้าเทียบกับการใช้งานจริงและพื้นที่ที่ได้คืนมา ถือว่าคุ้มค่ามากๆ เลยค่ะ แนะนำเลย!",,1,0,21,0,1,0,0,0
1380073,1260002,0.0,"กระเป๋าเป้เดินทาง Quechua 20 ลิตร ลุยได้ทุกทริป! 

ใครสายเดินป่า หรือชอบเที่ยวแบบ One Day Trip ต้องมีกระเป๋าเป้ Quechua 20 ลิตรใบนี้เลยค่ะ! คือมันเป็นกระเป๋าที่เบามาก แต่ช่องเก็บของเยอะมากกกก! จุของได้เยอะเกินคาดจริงๆ

เคยใช้ไปเดินป่าสั้นๆ คือสะพายสบายหลังมาก ไม่ปวดไหล่เลย ผ้าก็กันน้ำได้ดีระดับนึงนะ เจอฝนปรอยๆ ของข้างในก็ไม่เปียกเลย

ข้อดีคือเบา จุเยอะ กันน้ำได้ (ระดับนึง) และราคาเป็นมิตรสุดๆ! ใครกำลังหากระเป๋าเป้สำหรับทริปเล็กๆ หรือใช้ในชีวิตประจำวันก็คือเหมาะมากเลยค่ะ คุ้มค่าเกินราคาจริงๆ!",,1,0,33,0,0,1,0,0
1380074,1260003,36.0,"รีวิวน้ำตบ SK-II Facial Treatment Essence สกินแคร์ตัวท็อปในตำนาน

โอ้ยยย! ในที่สุดก็ได้ลองน้ำตบ SK-II Facial Treatment Essence ในตำนานสักทีค่ะ! ราคาเอาเรื่องอยู่นะ แต่ยอมใจขาดดิ้นเลยจริงๆ! ลองใช้มาสักพักแล้วอยากจะมาบอกต่อความรู้สึก

สิ่งแรกที่รู้สึกคือผิวดูใสขึ้น! รูขุมขนกระชับขึ้นนิดหน่อย และที่สำคัญคือผิวดูอิ่มฟู สุขภาพดีขึ้นมากๆ เลยค่ะ บางคนอาจจะไม่ชอบกลิ่นนะ แต่สำหรับเราคือรับได้นะ เพราะผลลัพธ์ที่ได้คือดีงามจริงๆ

ข้อดีคือผิวดูใสขึ้น อิ่มฟู รูขุมขนกระชับ ส่วนข้อเสียคือราคาค่อนข้างสูง และบางคนอาจจะไม่ชอบกลิ่นเฉพาะตัว แต่ถ้าใครกำลังมองหาน้ำตบดีๆ ที่ลงทุนแล้วเห็นผล เป็ดน้อยแนะนำตัวนี้เลยค่ะ! คือมันเป็นสกินแคร์ที่ควรมีติดโต๊ะจริงๆ!",,0,1,24,0,0,0,1,0
1380075,1260004,0.0,"ต่างหูเงินแท้ ดีไซน์มินิมอล ใส่ได้ทุกวันไม่มีเบื่อ

วันนี้ขอรีวิว Accessories ที่ใส่ได้ทุกวันไม่มีเบื่อเลยค่ะ นั่นก็คือต่างหูเงินแท้ดีไซน์มินิมอลคู่นี้นี่แหละ! คือเป็นคนชอบอะไรเรียบๆ แต่ดูดี แล้วคู่นี้คือตอบโจทย์มากๆ

ดีไซน์คือเรียบง่ายมาก ใส่ได้กับทุกลุคเลย ไม่ว่าจะแต่งตัวสบายๆ หรือจะแต่งตัวออกงานเบาๆ ก็เข้าหมดเลยค่ะ ที่สำคัญคือเป็นเงินแท้ ไม่แพ้ ไม่คัน ไม่ระคายเคืองผิวเลย เคยเจอต่างหูปลอมแล้วแพ้หนักมาก พอมาเจอคู่นี้คือสบายใจเลย

ข้อดีคือดีไซน์สวย มินิมอล ใส่ได้ทุกวัน ไม่แพ้ ไม่คัน ส่วนข้อสังเกตคืออาจจะไม่เหมาะกับคนที่ชอบต่างหูแบบอลังการหน่อย แต่ถ้าใครเป็นสายมินิมอล ชอบอะไรที่ใช้ง่าย ใส่ได้นานๆ แนะนำเลยค่ะ!",,1,0,30,0,0,0,0,1
1380076,1260005,0.0,"รีวิวลำโพงบลูทูธพกพา Marshall Kilburn II เสียงดี ดีไซน์เรโทรโดนใจ

โอ้ยยย! ลำโพงอะไรจะเท่ขนาดนี้! Marshall Kilburn II ตัวนี้คือโดนใจสายวินเทจแบบเราสุดๆ เลยค่ะ! ดีไซน์คือสวยคลาสสิกมากๆ วางตรงไหนก็ดูดีไปหมดเลย

เรื่องเสียงนี่ไม่ต้องพูดถึง! คือเสียงดีมากกกก! เบสแน่น กลางชัด แหลมใส เปิดเพลงฟังคือฟินสุดๆ ไม่ว่าจะฟังเพลงแนวไหนก็เพราะไปหมดเลยค่ะ แถมยังพกพาไปไหนมาไหนได้สะดวกด้วยนะ แบตก็อึดใช้ได้นานเลย

ข้อดีคือดีไซน์สวยคลาสสิก เสียงดีมาก พกพาสะดวก แบตอึด ส่วนข้อเสียคือราคาค่อนข้างสูง แต่ถ้าคุณเป็นคนรักเสียงเพลงและชอบดีไซน์แบบเรโทร แนะนำตัวนี้เลยค่ะ! เป็นการลงทุนที่คุ้มค่ามากๆ!",,1,0,21,1,0,0,0,0
1380077,1260006,0.0,"เก้าอี้ Ergonomic Sihoo M57 ดีต่อสุขภาพหลังในระยะยาว

ในฐานะมนุษย์ออฟฟิศที่ต้องนั่งหน้าคอมพ์วันละหลายชั่วโมง ขอรีวิวเก้าอี้ Ergonomic Sihoo M57 ตัวนี้เลยค่ะ! คือมันเปลี่ยนชีวิตเราจริงๆ นะ

ก่อนหน้านี้ปวดหลังหนักมาก นั่งนานๆ คือทรมานสุดๆ พอได้มาใช้เก้าอี้ตัวนี้คืออาการปวดหลังดีขึ้นเยอะมากค่ะ! มันรองรับสรีระได้ดีเยี่ยมจริงๆ ปรับได้หลายส่วนเลย ไม่ว่าจะเป็นพนักพิง ที่รองคอ ที่วางแขน คือปรับให้เข้ากับตัวเราได้หมดเลย

วัสดุก็แข็งแรงทนทาน ดูดีมีคุณภาพมากๆ นั่งสบายระบายอากาศได้ดีด้วย

ข้อดีคือดีต่อสุขภาพหลังมาก ปรับได้เยอะ วัสดุดี ทนทาน ส่วนข้อเสียคือราคาสูงกว่าเก้าอี้ทั่วไปหน่อย แต่ถ้ามองเป็นการลงทุนเพื่อสุขภาพในระยะยาวแล้ว ถือว่าคุ้มค่ามากๆ เลยค่ะ! ใครปวดหลังต้องลองเลยนะ!",,0,1,21,0,1,0,0,0
1380078,1260007,3.0,"เต็นท์ Coleman Instant Tent 4P กางง่าย เก็บเร็ว สำหรับสายแคมป์มือใหม่

สำหรับสายแคมป์ปิ้งมือใหม่แบบเรา เต็นท์ Coleman Instant Tent 4P ตัวนี้คือสวรรค์เลยค่ะ! คือมันกางง่ายมากกกก! แค่กางออกแล้วดึงๆ นิดหน่อยก็เป็นรูปเป็นร่างแล้ว ไม่ต้องเสียเวลามานั่งประกอบเสาให้ยุ่งยากเลย

เก็บก็ง่าย พับๆ ใส่ถุงก็เรียบร้อย เหมาะกับคนที่อยากไปแคมป์แต่ไม่อยากยุ่งยากกับการกางเต็นท์เลย

พื้นที่ด้านในก็กว้างขวางดีนะ นอนได้ 4 คนสบายๆ ระบายอากาศก็ดี ไม่อึดอัดเลย

ข้อดีคือกางง่าย เก็บเร็ว เหมาะกับมือใหม่ พื้นที่กว้าง ส่วนข้อเสียคืออาจจะไม่เหมาะกับอากาศหนาวจัดๆ หรือลมแรงมากๆ เพราะมันเน้นความง่ายในการกาง แต่โดยรวมแล้วถ้าคุณอยากลองไปแคมป์ปิ้งแบบสบายๆ แนะนำตัวนี้เลยค่ะ!",,1,0,30,0,0,1,0,0
1380079,1260008,0.0,"รีวิวคุชชั่น Laneige Neo Cushion Matte ปกปิดดี คุมมัน เที่ยวได้ทั้งวัน

สำหรับสาวๆ ที่ชอบงานผิวเนียนกริบ ปกปิดดี คุมมันเริ่ดๆ ต้องลองคุชชั่น Laneige Neo Cushion Matte ตัวนี้เลยค่ะ! คือมันดีงามพระรามแปดจริงๆ!

เป็นคนผิวมัน มีรอยสิวบ้าง พอใช้ตัวนี้คือปกปิดได้ดีมากๆ เลยค่ะ แต่ยังให้ความเป็นผิวอยู่นะ ไม่ได้หนาโบ๊ะเลย ที่สำคัญคือคุมมันได้ดีมาก! เคยใช้ตั้งแต่เช้าออกไปข้างนอกทั้งวัน หน้าก็ยังไม่เยิ้มเลยค่ะ คือดีงามมากๆ

ดีไซน์ตลับก็คือมินิมอลน่ารัก พกพาสะดวกด้วยนะ

ข้อดีคือปกปิดดี คุมมันดี ติดทน ให้ความเป็นผิว ส่วนข้อเสียคืออาจจะไม่เหมาะกับคนผิวแห้งมาก เพราะฟินิชจะแมตต์ ถ้าผิวแห้งอาจจะตกร่องได้นิดหน่อย แต่ถ้าคุณเป็นสาวผิวมันหรือผิวผสม แนะนำตัวนี้เลยค่ะ! ของมันต้องมี!",,1,0,125,0,0,0,1,0
