post_id,owner_id,PostEngagement,Content,Comments,Male,Female,Age,Electronics_Gadgets,Furniture,Outdoor_Gear,Beauty_Products,Accessories
1380096,1260025,0.0,"สมาร์ททีวี Samsung Crystal UHD 4K ภาพสวยคมชัด เสียงดี ดูหนังฟิน

วันนี้จะมารีวิวสมาร์ททีวี Samsung Crystal UHD 4K เครื่องใหม่! คือมันเปลี่ยนประสบการณ์การดูหนังที่บ้านจริงๆ ค่ะ!

ภาพสวยคมชัดมาก! ด้วยความละเอียด 4K คือดูหนังแล้วได้รายละเอียดที่คมกริบ สีสันสดใสสมจริงมากๆ เลยค่ะ เสียงก็ดีงามนะ ไม่ต้องต่อลำโพงแยกก็ยังได้เสียงที่กระหึ่มเหมือนอยู่ในโรงหนังเลย

สมาร์ทฟังก์ชันก็คือใช้ง่ายมากๆ เชื่อมต่ออินเทอร์เน็ตได้เร็ว ดู Netflix, YouTube คือลื่นไหลไม่มีสะดุดเลย

ข้อดีคือภาพสวยคมชัด เสียงดี สมาร์ทฟังก์ชันครบครัน ส่วนข้อเสีย... ยังไม่เจอเลย! ถ้าคุณกำลังมองหาสมาร์ททีวีดีๆ สักเครื่องที่ให้ประสบการณ์การดูหนังที่ยอดเยี่ยม แนะนำตัวนี้เลยค่ะ!",,1,0,21,1,0,0,0,0
1380097,1260026,0.0,"ชั้นวางหนังสือ IKEA BILLY ชั้นวางคลาสสิกที่บ้านทุกหลังควรมี

สำหรับคนรักหนังสือ หรือคนที่ต้องการชั้นวางของที่ใช้งานได้หลากหลาย ต้องชั้นวางหนังสือ IKEA BILLY ตัวนี้เลยค่ะ! คือมันเป็นชั้นวางที่คลาสสิกมากๆ แล้วก็ใช้งานได้จริงสุดๆ

ดีไซน์คือเรียบง่าย มินิมอล วางตรงไหนก็เข้ากับห้องได้หมดเลยค่ะ มีหลายขนาดให้เลือกด้วยนะ จะวางหนังสือ ของตกแต่ง หรือจะวางของใช้ต่างๆ ก็คือทำได้หมดเลย

ประกอบก็ง่ายนะ ไม่ได้ยุ่งยากเลย วัสดุก็แข็งแรงทนทานดีด้วย ราคาเป็นมิตรด้วยนะ

ข้อดีคือใช้งานได้หลากหลาย ดีไซน์สวยคลาสสิก ราคาดี แข็งแรง ส่วนข้อเสีย... ยังไม่เจอเลย! ถ้าคุณกำลังมองหาชั้นวางหนังสือหรือชั้นวางของที่ใช้งานได้จริงและราคาดี แนะนำชั้น BILLY ตัวนี้เลยค่ะ!",,1,0,21,0,1,0,0,0
1380098,1260027,0.0,"ชุดเดินป่า Columbia Set แจ็คเก็ตและกางเกง กันน้ำ กันลม ลุยได้ทุกสภาพอากาศ

ใครสายลุย เดินป่า ปีนเขา ต้องมีชุดเดินป่า Columbia Set นี้เลยค่ะ! คือมันเป็นชุดที่เปลี่ยนการเดินป่าของเราจริงๆ นะ

แจ็คเก็ตและกางเกงคือกันน้ำได้ดีมาก! เคยเดินลุยฝนหนักๆ ก็คือไม่เปียกเลย กันลมได้ดีด้วย ทำให้เราอบอุ่นอยู่ตลอดเวลาเลย วัสดุก็ระบายอากาศได้ดีนะ ไม่ร้อน ไม่อับเลยค่ะ

ที่สำคัญคือทนทานมากๆ ใส่ลุยป่าลุยเขามาหลายทริปแล้วก็ยังไม่ขาดไม่เปื่อยเลย

ข้อดีคือกันน้ำ กันลม ทนทาน ระบายอากาศดี ส่วนข้อเสียคือราคาค่อนข้างสูงไปนิดนึง แต่ถ้าเทียบกับคุณภาพและการใช้งานที่ได้มา ถือว่าคุ้มค่ามากๆ เลยค่ะ! ใครสายลุย ต้องมีชุดนี้เลย!",,0,1,22,0,0,1,0,0
1380099,1260028,0.0,"มาสคาร่า Maybelline Sky High Mascara ขนตายาว งอน เด้งตลอดวัน

สำหรับสาวๆ ที่ชอบขนตายาวๆ งอนๆ เด้งๆ ต้องมาสคาร่า Maybelline Sky High Mascara ตัวนี้เลยค่ะ! คือมันเป็นมาสคาร่าที่เปลี่ยนขนตาของเราจริงๆ นะ

ปัดแล้วขนตายาวขึ้นจริง! งอนเด้งมากๆ เลยค่ะ ไม่จับเป็นก้อน ไม่แพนด้าด้วยนะ เคยปัดตั้งแต่เช้าออกไปข้างนอกทั้งวัน ขนตาก็ยังงอนเด้งอยู่เลย คือดีงามมากๆ

ราคาเป็นมิตร หาซื้อง่ายด้วยนะ

ข้อดีคือขนตายาว งอนเด้ง ไม่จับก้อน ไม่แพนด้า ติดทน ส่วนข้อเสีย... ยังไม่เจอเลย! ถ้าคุณกำลังมองหามาสคาร่าดีๆ ที่ให้ผลลัพธ์ปังๆ และราคาดี แนะนำตัวนี้เลยค่ะ!",,1,0,23,0,0,0,1,0
1380100,1260029,0.0,"กระเป๋าผ้าแคนวาส ดีไซน์น่ารัก ใส่ของได้เยอะ ไปได้ทุกที่

วันนี้ขอรีวิว Accessories ที่ใช้ได้ทุกวัน! กระเป๋าผ้าแคนวาสดีไซน์น่ารักใบนี้เลยค่ะ! คือมันเป็นกระเป๋าที่เหมาะกับทุกโอกาสจริงๆ นะ

ดีไซน์คือเรียบง่าย แต่น่ารักมากๆ มีลายให้เลือกเยอะเลย ใส่ไปเรียน ใส่ไปทำงาน หรือใส่ไปเที่ยวก็คือเข้าหมดเลยค่ะ ที่สำคัญคือมันจุของได้เยอะมาก! ใส่หนังสือ โน้ตบุ๊ก ขวดน้ำ คือยัดได้หมดเลย

วัสดุเป็นผ้าแคนวาส ทนทานมากๆ เลยนะ ซักทำความสะอาดก็ง่ายด้วย

ข้อดีคือจุของได้เยอะ ดีไซน์น่ารัก ทนทาน ราคาเป็นมิตร ส่วนข้อเสีย... ยังไม่เจอเลย! ถ้าคุณกำลังมองหากระเป๋าที่ใช้งานได้จริง และราคาดี แนะนำใบนี้เลยค่ะ!",,0,1,20,0,0,0,0,1
1380101,1260036,28.0,"Nintendo Switch OLED เครื่องเล่นเกมพกพา ภาพสวย สีสด เล่นได้ทุกที่

วันนี้ขอรีวิวเครื่องเล่นเกมพกพาตัวโปรด! Nintendo Switch OLED ตัวนี้เลยค่ะ! คือมันเป็นเครื่องเล่นเกมที่เปลี่ยนประสบการณ์การเล่นเกมของเราจริงๆ นะ

หน้าจอ OLED คือสวยคมชัดมาก! สีสันสดใสมากๆ เลยค่ะ เล่นเกมแล้วได้อรรถรสมากขึ้นเยอะเลย ไม่ว่าจะเล่นที่บ้านหรือพกพาไปเล่นข้างนอกก็ได้หมดเลย

Joy-Con ก็คือถอดออกได้ เล่นกับเพื่อนได้หลายคนเลย สะดวกมากๆ

ข้อดีคือหน้าจอสวยคมชัด พกพาง่าย เล่นกับเพื่อนได้หลากหลาย ส่วนข้อเสียคือราคาสูงกว่ารุ่นปกติไปนิดนึง แต่ถ้าคุณชอบเล่นเกมแบบพกพา และต้องการภาพที่สวยคมชัด แนะนำตัวนี้เลยค่ะ!",น่าเล่นดีนะ; ขอวาร์ปหน่อยได้มะครับ,1,0,21,1,0,0,0,0
1380102,780010,0.0,"โต๊ะเครื่องแป้ง IKEA MALM พร้อมกระจกและลิ้นชัก จัดเก็บของได้เยอะ

สำหรับสาวๆ ที่ต้องการโต๊ะเครื่องแป้งที่ใช้งานได้จริง จัดเก็บของได้เยอะ และดีไซน์สวย ต้องโต๊ะเครื่องแป้ง IKEA MALM ตัวนี้เลยค่ะ! คือมันเป็นโต๊ะที่ตอบโจทย์มากๆ เลยนะ

มีกระจกในตัว พร้อมลิ้นชักใหญ่ๆ หลายช่อง คือเก็บเครื่องสำอาง สกินแคร์ อุปกรณ์แต่งหน้าได้เยอะมากๆ เลยค่ะ ทำให้โต๊ะไม่รกเลย ดีไซน์ก็เรียบง่าย มินิมอล เข้ากับห้องได้ง่ายมากๆ

ประกอบก็ง่ายนะ ไม่ได้ยุ่งยากอย่างที่คิดเลยค่ะ วัสดุก็แข็งแรงทนทานดีด้วย

ข้อดีคือจัดเก็บของได้เยอะ ดีไซน์สวย ใช้งานได้จริง แข็งแรง ส่วนข้อเสีย... ยังไม่เจอเลย! ถ้าคุณกำลังมองหาโต๊ะเครื่องแป้งดีๆ ที่ช่วยจัดระเบียบของได้ดี แนะนำตัวนี้เลยค่ะ!",,0,1,21,0,1,0,0,0
1380105,1050002,0.0,"กระเป๋าโท้ทผ้าแคนวาส Uniqlo Round Mini Shoulder Bag ใบจิ๋วแต่แจ๋ว จุของได้เยอะเกินคาด

วันนี้ขอรีวิว Accessories สุดฮิต! กระเป๋าโท้ทผ้าแคนวาส Uniqlo Round Mini Shoulder Bag ใบนี้เลยค่ะ! คือมันเป็นกระเป๋าที่ฮิตมากๆ แล้วก็ใช้งานได้จริงสุดๆ

ดีไซน์คือเรียบง่ายแต่น่ารักมากๆ มีหลายสีให้เลือกด้วยนะ ใส่ได้กับทุกสไตล์เลยค่ะ ที่สำคัญคือมันจุของได้เยอะมาก! เคยลองใส่ขวดน้ำ มือถือ กระเป๋าสตางค์ กุญแจ คือยัดได้หมดเลยนะ ไม่น่าเชื่อว่าใบแค่นี้จะจุได้เยอะขนาดนี้

วัสดุเป็นผ้าแคนวาส ทนทานมากๆ เลยนะ ซักทำความสะอาดก็ง่ายด้วย

ข้อดีคือจุของได้เยอะ ดีไซน์น่ารัก ราคาเป็นมิตร ทนทาน ส่วนข้อเสีย... ยังไม่เจอเลย! ถ้าคุณกำลังมองหากระเป๋าที่ใช้งานได้จริง และราคาดี แนะนำใบนี้เลยค่ะ!",,1,0,24,0,0,0,0,1
1380106,1110001,0.0,"เครื่องดูดฝุ่นไร้สาย Dyson V15 Detect Absolute ทำความสะอาดบ้านได้สะอาดหมดจด

วันนี้ขอรีวิวเครื่องดูดฝุ่นไร้สายตัวโปรด! Dyson V15 Detect Absolute ตัวนี้เลยค่ะ! คือมันเป็นเครื่องดูดฝุ่นที่เปลี่ยนการทำความสะอาดบ้านของเราจริงๆ นะ

พลังดูดคือแรงมาก! ดูดฝุ่นได้สะอาดหมดจดจริงๆ ไม่ว่าจะเป็นฝุ่นเล็กๆ ผม หรือเศษอาหาร ก็คือดูดได้หมดเลย หัวดูดก็มีไฟเลเซอร์ส่องนำทางด้วยนะ ทำให้เห็นฝุ่นที่มองไม่เห็นด้วยตาเปล่า คือดีงามมากๆ

ใช้งานง่ายมากๆ เลยนะ ไร้สายก็คือสะดวกสุดๆ ไม่ต้องลากสายให้ยุ่งยากเลย แบตเตอรี่ก็อึดใช้ได้นานเลยค่ะ

ข้อดีคือพลังดูดแรง ทำความสะอาดได้สะอาดหมดจด ใช้งานง่าย ไร้สาย ส่วนข้อเสียคือราคาค่อนข้างสูงไปนิดนึง แต่ถ้าคุณต้องการเครื่องดูดฝุ่นคุณภาพดีที่ทำความสะอาดบ้านได้สะอาดหมดจด แนะนำตัวนี้เลยค่ะ!",,1,0,21,1,0,0,0,0
1380107,1140001,0.0,"โต๊ะกาแฟ IKEA LACK โต๊ะมินิมอล ราคาดีงาม วางตรงไหนก็สวย

สำหรับคนที่ต้องการโต๊ะกาแฟง่ายๆ ดีไซน์มินิมอล ราคาเป็นมิตร ต้องโต๊ะกาแฟ IKEA LACK ตัวนี้เลยค่ะ! คือมันเป็นโต๊ะที่ตอบโจทย์มากๆ เลยนะ

ดีไซน์คือเรียบง่ายมากๆ วางตรงไหนก็เข้ากับห้องได้หมดเลยค่ะ จะวางแก้วกาแฟ หนังสือ หรือของตกแต่งก็คือทำได้หมดเลย

ประกอบก็ง่ายนะ ไม่ได้ยุ่งยากเลย วัสดุก็แข็งแรงทนทานดีด้วย ราคาดีงามมากๆ ด้วยนะ

ข้อดีคือดีไซน์สวย มินิมอล ราคาดี ประกอบง่าย แข็งแรง ส่วนข้อเสียคืออาจจะดูเป็นเฟอร์นิเจอร์แบบชั่วคราวไปหน่อยถ้าคุณต้องการความหรูหรา แต่โดยรวมแล้วถ้าคุณต้องการโต๊ะกาแฟที่ใช้งานได้จริงและราคาดี แนะนำตัวนี้เลยค่ะ!",,1,0,21,0,1,0,0,0
1380108,1170001,15.0,"ถุงนอน The North Face One Bag อุ่นสบาย ปรับได้ 3 ระดับ สำหรับทุกสภาพอากาศ

ใครสายแคมป์ปิ้ง สายลุย ต้องมีถุงนอน The North Face One Bag ตัวนี้เลยค่ะ! คือมันเป็นถุงนอนที่เปลี่ยนการนอนในเต็นท์ของเราจริงๆ นะ

อุ่นสบายมาก! ไม่ว่าจะอากาศหนาวแค่ไหนก็คือเอาอยู่หมดเลยค่ะ ที่สำคัญคือมันปรับได้ 3 ระดับเลยนะ สำหรับอากาศร้อน อากาศเย็น และอากาศหนาวจัดๆ คือซื้อถุงเดียวจบเลย ไม่ต้องมีหลายถุง

วัสดุคุณภาพดีมากๆ เลยนะ นุ่มสบาย ไม่ระคายเคืองผิวเลย พับเก็บก็เล็กกระทัดรัด พกพาง่ายด้วย

ข้อดีคืออุ่นสบาย ปรับได้ 3 ระดับ คุณภาพดี พกพาง่าย ส่วนข้อเสียคือราคาค่อนข้างสูงไปนิดนึง แต่ถ้าคุณเป็นสายแคมป์ปิ้งตัวจริงที่ต้องการถุงนอนที่ใช้งานได้หลากหลาย แนะนำตัวนี้เลยค่ะ!",,1,0,20,0,0,1,0,0
1380109,1200001,7.0,"กันแดด Anessa Perfect UV Sunscreen Skincare Milk N กันแดดขั้นเทพ บางเบา ไม่เหนอะหนะ

สำหรับสาวๆ ที่ต้องการกันแดดขั้นเทพ ที่บางเบา ไม่เหนียวเหนอะหนะ ต้องกันแดด Anessa Perfect UV Sunscreen Skincare Milk N ตัวนี้เลยค่ะ! คือมันเป็นกันแดดที่ต้องมีติดโต๊ะเครื่องแป้งจริงๆ นะ

เนื้อสัมผัสคือบางเบามากๆ ซึมซาบเร็ว ไม่เหนียวเหนอะหนะเลย ทาแล้วสบายผิวมากๆ ไม่รู้สึกหนักหน้าเลย ที่สำคัญคือกันแดดได้ดีเยี่ยม! เคยใช้ไปเที่ยวทะเล ตากแดดทั้งวัน หน้าก็ยังไม่คล้ำเลยค่ะ

ข้อดีคือกันแดดดีมาก เนื้อบางเบา ซึมซาบเร็ว ไม่เหนียวเหนอะหนะ ส่วนข้อเสีย... ยังไม่เจอเลย! ถ้าคุณกำลังมองหากันแดดดีๆ ที่ให้ความรู้สึกสบายผิว และกันแดดได้ดีเยี่ยม แนะนำตัวนี้เลยค่ะ!",,1,0,32,0,0,0,1,0
1380110,1200003,8.0,"กระเป๋าถือ Longchamp Le Pliage Club กระเป๋าในฝันของสาวๆ ทุกคน

วันนี้ขอรีวิว Accessories ที่สาวๆ ทุกคนควรมี! กระเป๋าถือ Longchamp Le Pliage Club ใบนี้เลยค่ะ! คือมันเป็นกระเป๋าที่คลาสสิกมากๆ แล้วก็ใช้งานได้จริงสุดๆ

ดีไซน์คือเรียบง่ายแต่ดูดีมีสไตล์มากๆ มีหลายสีให้เลือกด้วยนะ พับเก็บได้เล็กกระทัดรัด พกพาสะดวกมากๆ ที่สำคัญคือมันจุของได้เยอะมาก! ใส่ของได้ครบทุกอย่างเลย ไม่ว่าจะไปทำงาน ไปเที่ยว หรือไปช้อปปิ้งก็คือเอาอยู่หมดเลย

วัสดุไนลอนก็ทนทานมากๆ เลยนะ กันน้ำได้ด้วย

ข้อดีคือจุของได้เยอะ ดีไซน์สวยคลาสสิก พับเก็บได้ ทนทาน ส่วนข้อเสียคือราคาค่อนข้างสูงไปนิดนึง แต่ถ้าคุณกำลังมองหากระเป๋าที่ใช้งานได้จริง และดีไซน์สวยคลาสสิก แนะนำใบนี้เลยค่ะ!",,1,0,32,0,0,0,0,1
1380111,1230001,0.0,"หุ่นยนต์ดูดฝุ่น Roborock S8 Pro Ultra ทำความสะอาดบ้านได้อัจฉริยะสุดๆ

วันนี้ขอรีวิวเครื่องใช้ไฟฟ้าในบ้านที่เปลี่ยนชีวิตเราจริงๆ! หุ่นยนต์ดูดฝุ่น Roborock S8 Pro Ultra ตัวนี้เลยค่ะ! คือมันเป็นหุ่นยนต์ดูดฝุ่นที่อัจฉริยะมากๆ

ทำความสะอาดบ้านได้สะอาดหมดจดจริงๆ ไม่ว่าจะเป็นฝุ่น ผม หรือเศษอาหาร ก็คือดูดได้หมดเลย แถมยังถูพื้นได้ด้วยนะ คือจบในเครื่องเดียวเลย! มันฉลาดมากๆ ด้วยนะ วางแผนการทำความสะอาดเองได้ หลบสิ่งกีดขวางได้ด้วย

ควบคุมผ่านแอปพลิเคชันได้ง่ายๆ เลยนะ สั่งให้ดูดฝุ่นตอนที่เราไม่อยู่บ้านก็ได้ สะดวกมากๆ

ข้อดีคือทำความสะอาดได้สะอาดหมดจด ฉลาด ใช้งานง่าย มีฟังก์ชันถูพื้นด้วย ส่วนข้อเสียคือราคาค่อนข้างสูงไปนิดนึง แต่ถ้าคุณต้องการหุ่นยนต์ดูดฝุ่นที่ทำงานได้ดีเยี่ยมและประหยัดเวลาการทำความสะอาดบ้าน แนะนำตัวนี้เลยค่ะ!",,1,0,20,1,0,0,0,0
