post_id,owner_id,PostEngagement,Content,Comments,Male,Female,Age,Electronics_Gadgets,Furniture,Outdoor_Gear,Beauty_Products,Accessories
1380054,1260018,10.5,"Logitech G Pro X Superlight Wireless Gaming Mouse White

กรี๊ดดดดด! เมาส์อะไรจะเบาขนาดนี้! Logitech G Pro X Superlight Wireless Gaming Mouse White คือที่สุดของความเบาจริงๆ! ไม่ถึง 63 กรัม! เหมือนไม่ได้ถือเมาส์เลยอ่ะ

เป็นคนเล่นเกม FPS ที่ต้องใช้ความเร็วและความแม่นยำสูงๆ เมาส์ตัวนี้คือตอบโจทย์สุดๆ เลยค่ะ การเคลื่อนไหวลื่นไหลมาก แทบไม่มีแรงเสียดทานเลย ทำให้ขยับเมาส์ได้คล่องตัวสุดๆ ยิงหัวได้ง่ายขึ้นเยอะเลย

ดีไซน์ก็คือมินิมอลแต่ดูโปรมาก สีขาวก็คือสวยคลีนๆ ดูแพงสุดๆ แบตเตอรี่ก็อึดใช้ได้นานเลย

ข้อดีคือเบามากกกกก ลื่นไหล แม่นยำ เหมาะกับเกมเมอร์มือโปรมากๆ ค่ะ ส่วนข้อเสียคือราคาก็แรงตามคุณภาพเลย แต่ถ้าใครเป็นสาย E-sport หรืออยากอัปเกรดประสบการณ์การเล่นเกมไปอีกขั้น แนะนำตัวนี้เลย ไม่ผิดหวังแน่นอน!",,0,1,24,1,0,0,0,0
1380055,1260018,9.0,"soundpeats air 3

วันนี้จะมารีวิวหูฟังไร้สายขวัญใจมหาชนอย่าง SoundPEATS Air3 นะ!

ยอมรับว่าตอนแรกก็ลังเลอยู่เหมือนกันว่าจะคุ้มไหม เพราะราคาก็สูงกว่ารุ่น TrueAir 2 อยู่หน่อย แต่พอได้ลองใช้เท่านั้นแหละ... ยอมรับเลยว่าคุ้ม! กล่องชาร์จเล็กกระทัดรัด พกพาง่ายขึ้นเยอะเลย ใส่กระเป๋าเล็กๆ ก็สบาย

ที่ประทับใจสุดๆ คือเรื่องไมค์! คุยโทรศัพท์เสียงชัดมาก อีกฝ่ายได้ยินชัดเจน ไม่ต้องตะโกนเลยค่ะ อันนี้คือดีงามสำหรับคนที่ใช้หูฟังคุยโทรศัพท์บ่อยๆ อย่างเราเลย ส่วนเรื่องเสียงเพลงก็คือฟังละมุน หวานหูดีค่ะ ไม่ได้เบสตึ้บตั้บมาก แต่ก็ฟังได้เพลินๆ ทุกแนว

ข้อดีคือไมค์ดี กล่องเล็กกระทัดรัด เสียงฟังเพราะ ส่วนข้อสังเกตคือถ้าใครชอบเบสหนักๆ อาจจะต้องมองข้ามไปหน่อย แต่โดยรวมแล้วถ้าเน้นคุยโทรศัพท์และฟังเพลงในชีวิตประจำวัน แนะนำ SoundPEATS Air3 ตัวนี้เลย!",,0,1,24,1,0,0,0,0
1380056,1260021,3.0,"AirPods 4

ฮัลโหลทุกคน! วันนี้มาป้ายยา AirPods 4 ที่เพิ่งได้มาใหม่เลย! บอกเลยว่าตัวนี้คือดีงามมากจริงๆ

สิ่งที่ชอบที่สุดคือเรื่องการแยกเสียง! คือมันทำให้เสียงพูดชัดเจนขึ้นมาก ไม่ว่าจะคุยโทรศัพท์หรือฟังพอดแคสต์คือได้ยินชัดทุกคำเลย แถมยังมีฟังก์ชัน Siri ในตัวอีก สะดวกสุดๆ อยากฟังเพลงอะไร อยากโทรหาใครก็แค่เรียก Siri ได้เลย

ที่สำคัญคือเรื่องความสบายในการสวมใส่ค่ะ! เขามีการอัปเดตมาใหม่ ทำให้มันกระชับหูมากๆ ใส่ได้ทั้งวันก็ไม่รู้สึกเจ็บเลย เหมาะกับคนที่ต้องใส่หูฟังนานๆ มากๆ

ข้อดีคือเสียงดี ฟังก์ชันครบ ใส่สบาย ส่วนข้อสังเกตคือถ้าใครติดหูฟังแบบ In-ear ที่ซีลเสียงได้สนิท อาจจะต้องลองก่อนว่าชอบฟีลแบบนี้ไหม แต่โดยรวมแล้ว ถือว่ามันเป็นการลงทุนที่คุ้มค่ามากๆ เลย! ใครกำลังหาหูฟังคู่ใจ บอกเลยว่า AirPods 4 คือตัวเลือกที่ไม่ควรมองข้ามนะ!",อยากได้จุงเบย,1,0,34,1,0,0,0,0
1380057,1260021,6.0,"เก้าอี้เกมมิ่ง Anda Seat Gaming Chair Kaiser 3 Size XL Black

โอ้ยยย! คุณพระคุณเจ้า! เก้าอี้เกมมิ่ง Anda Seat Gaming Chair Kaiser 3 Size XL Black ตัวนี้คือที่สุดของความสบายจริงๆ! ในฐานะที่นั่งหน้าคอมพ์เป็นเวลานานๆ ทั้งเล่นเกมและทำงาน ขอยืนยันเลยว่าตัวนี้คือ Must-have!

วัสดุที่เขาใช้คือ DuraXtra ซึ่งนุ่มสบายมากจริงๆ ค่ะ นั่งนานแค่ไหนก็ไม่ปวด แถมยังลดร่องรอยขีดข่วนได้ดีด้วย เหมาะกับคนซุ่มซ่ามเลย ???? เบาะนั่งก็กว้างขวาง นั่งสบาย รองรับสรีระได้ดีเยี่ยม ไม่เมื่อยหลังเลย

ข้อดีคือสบายมากกกก วัสดุดี ทนทาน ประกอบง่าย ส่วนข้อเสีย... อาจจะต้องใช้พื้นที่หน่อยเพราะเป็น Size XL แต่ถ้าคุณมีพื้นที่และอยากได้เก้าอี้ที่นั่งสบายและดีต่อสุขภาพ แนะนำตัวนี้เลย! ยอมลงทุนเถอะค่ะ หลังไม่พังแน่นอน!",Look so coolllll,1,0,34,0,1,0,0,0
1380058,1260021,6.0,"เก้าอี้เกมมิ่ง Tengu Gaming Chair Muramasa Red

วันนี้จะมารีวิวเก้าอี้เกมมิ่งสุดเท่! Tengu Gaming Chair Muramasa Red ตัวนี้เลย! คือเห็นแว้บแรกก็โดนตกด้วยดีไซน์สายสปอร์ตสีแดงดำสุดคูลแล้วค่ะ

ในฐานะเกมเมอร์ที่ต้องนั่งเล่นเกมยาวๆ การมีเก้าอี้ดีๆ สำคัญมากเลย ตัวนี้วัสดุเป็นหนัง PU ทำความสะอาดง่ายดีค่ะ แถมปรับเอนได้เยอะถึง 90-135 องศา คือเอนนอนดูหนังได้สบายๆ เลย โครงสร้างเหล็กก็แข็งแรงมาก รับน้ำหนักได้ถึง 120 กก. สายกินก็คือรอด! ????

ที่ท้าวแขนก็ปรับสูงได้ถึง 10 ซม. คือดีงามสำหรับคนตัวเล็กตัวใหญ่ แถมมีที่พักเท้าด้วยนะ! คือนั่งแล้วสบายเหมือนอยู่สวรรค์เลย

ข้อดีคือดีไซน์เท่ ปรับได้เยอะ แข็งแรง ทนทาน ส่วนข้อสังเกตคือถ้าใครชอบเบาะแบบนุ่มๆ อาจจะต้องลองนั่งดูก่อน เพราะตัวนี้จะเน้นความกระชับหน่อย แต่โดยรวมแล้ว ถือว่าคุ้มค่ามากๆ สำหรับเกมเมอร์ที่อยากได้เก้าอี้ดีๆ สักตัว!",,1,0,34,0,1,0,0,0
1380059,1260021,0.0,"สมาร์ทโฟน Samsung Galaxy Z Flip6 (12+256GB) Light blue (5G)

โอ้ยยย! ในที่สุดก็ได้มาลองเล่น Samsung Galaxy Z Flip6 สี Light blue สุดน่ารักตัวนี้แล้ว! บอกเลยว่าโดนตกตั้งแต่ดีไซน์เลยค่ะ!

คือมันเล็กกะทัดรัดมาก พกง่ายสุดๆ ใส่กระเป๋าใบจิ๋วก็ยังได้เลย! เปิดออกมาเป็นจอก็ใหญ่สะใจใช้งานสะดวกมากๆ โดยเฉพาะจอนอกที่ตอนนี้ใช้งานได้เยอะขึ้นเยอะเลย ไม่ต้องเปิดเครื่องบ่อยๆ ก็เช็คแจ้งเตือน ตอบแชทได้สบายๆ

เรื่องกล้องก็คือถ่ายสวยคมชัดมาก ที่สำคัญคือเวลาเพื่อนถ่ายรูปให้ เราก็มองเห็นตัวเองบนจอนอกได้ด้วย คือได้ช็อตเป๊ะแน่นอน ไม่ต้องมาลุ้นรูปเบลออีกต่อไป! แถม AI ของ Galaxy ก็คือช่วยให้ชีวิตง่ายขึ้นอีกขั้นจริงๆ ค่ะ

ข้อดีคือดีไซน์เก๋ พกง่าย กล้องดี มี AI แบตเตอรี่ก็อึดขึ้นเยอะเลย ส่วนข้อเสีย... ยังไม่เจอเลย! ใครที่ชอบความเก๋ไก๋ ฟังก์ชันครบครัน และพกพาง่าย แนะนำตัวนี้เลย!",,1,0,34,1,0,0,0,0
1380060,1260021,0.0,"Apple iPad Air 11-inch (M2) Wi-Fi 128GB Space Gray

ในที่สุดก็ได้น้อง iPad Air 11-inch (M2) มาครอบครองแล้ว! สี Space Gray คือสวยหรูดูแพงมากจริงๆ!

บอกเลยว่าชิป M2 เนี่ยคือแรงเหลือเฟือจริงๆ ไม่ว่าจะทำงานมัลติทาสก์หนักแค่ไหน เปิดหลายแอปพร้อมกันก็คือลื่นปรื๊ดๆ ไม่มีสะดุดเลย เอามาใช้ทั้งเรียน ทำงาน แล้วก็ดูหนังเล่นเกมคือครบจบในเครื่องเดียวจริงๆ

ที่ว้าวอีกอย่างคือกล้องหน้าแนวนอนค่ะ! คือมันเหมาะกับการ FaceTime หรือประชุมออนไลน์มากๆ เลย มุมกล้องคือดีงาม ทำให้การคุยสะดวกขึ้นเยอะเลย

ข้อดีคือแรง ลื่นไหล ทำงานได้หลากหลาย กล้องหน้าดีงาม ส่วนข้อเสีย... ก็คือราคาที่อาจจะทำให้กระเป๋าตังค์สั่นเล็กน้อย ???? แต่ถ้าคุณต้องการแท็บเล็ตที่ครบเครื่องทั้งเรื่องประสิทธิภาพและความสะดวกสบาย แนะนำตัวนี้เลย! คุ้มค่าทุกบาททุกสตางค์จริงๆ!",,1,0,34,1,0,0,0,0
1380061,1260021,6.0,"กระเป๋า AMAZINGthing MacBook Sleeve 14 inch Matte Pro with Stand New Grey

ในที่สุดก็ได้กระเป๋า MacBook ใบใหม่! AMAZINGthing MacBook Sleeve 14 inch Matte Pro with Stand New Grey คือตอบโจทย์สุดๆ เลย!

ปกติเป็นคนชอบพก MacBook ไปทำงานนอกบ้านบ่อยๆ กระเป๋า Sleeve ตัวนี้คือดีไซน์สวยมาก สีเทาคือดูดีมีสไตล์สุดๆ เลย แถมวัสดุก็ดูทนทานดีด้วย การปิดด้วยแม่เหล็กก็คือแน่นหนา ไม่ต้องกลัว MacBook หลุดออกมาเลยค่ะ

ที่ว้าวคือมันมีขาตั้งในตัวด้วย! คือสามารถกางออกมาเป็นขาตั้งสำหรับวาง MacBook ได้เลย ทำให้เราพิมพ์งานได้สะดวกสบายขึ้นเยอะ ไม่ต้องก้มคอมาก พกไปที่เดียวได้ทั้งกระเป๋าและขาตั้งเลย สะดวกสุดๆ

ข้อดีคือดีไซน์สวย วัสดุทนทาน มีขาตั้งในตัว พกพาสะดวก ส่วนข้อเสีย... ยังไม่เจอเลย! ถ้าใครใช้ MacBook และกำลังมองหากระเป๋า Sleeve ดีๆ ที่มีฟังก์ชันเสริม แนะนำตัวนี้เลย! รับรองไม่ผิดหวัง!",wow,1,0,34,0,0,0,0,1
1380062,1260021,6.0,"พาวเวอร์แบงค์ AUKEY 10,000 mAh Magnetic Wireless Charging PB-MS02 Black

โอ้ยยยย! เจอพาวเวอร์แบงค์คู่ใจแล้ว! AUKEY 10,000 mAh Magnetic Wireless Charging PB-MS02 Black ตัวนี้คือดีงามมากจริงๆ นะ!

ปกติเป็นคนขี้ลืมสายชาร์จ ชอบลืมพกสายตลอดเวลา พอมีตัวนี้คือชีวิตง่ายขึ้นเยอะเลย เพราะมันชาร์จไร้สายได้! แค่แปะมือถือลงไปก็ชาร์จได้เลย แถมยังเป็น Magnetic ด้วยนะ คือมันดูดติดแน่นเลย ไม่ต้องกลัวหลุดเลยค่ะ

ความจุ 10,000 mAh ก็คือพอสำหรับการใช้งานทั้งวันเลย ชาร์จมือถือได้หลายรอบ แถมยังชาร์จได้ทั้งแบบมีสายและไร้สายพร้อมกันด้วย สะดวกสุดๆ ไปเลย

ที่เด็ดคือมีขาตั้งพับเก็บได้! คือสามารถกางออกมาตั้งมือถือเพื่อดูหนังหรือวิดีโอไปพร้อมๆ กับชาร์จได้เลย อันนี้คือฟังก์ชันที่ชอบมากจริงๆ

ข้อดีคือชาร์จไร้สายได้ มีแม่เหล็กดูด มีขาตั้ง พกพาสะดวก ส่วนข้อเสีย... ยังไม่เจอเลย! ถ้าใครกำลังมองหาพาวเวอร์แบงค์ดีๆ ที่ครบเครื่อง แนะนำตัวนี้เลย!",,1,0,34,1,0,0,0,0
1380063,1260018,0.0,"สมาร์ทโฟน Samsung Galaxy S24 ULTRA (12+512) TITANIUM (5G)

สวัสดีทุกคน! วันนี้จะมารีวิวสมาร์ทโฟนคู่ใจตัวใหม่ล่าสุด นั่นก็คือ Samsung Galaxy S24 ULTRA (12+512) TITANIUM (5G) นั่นเอง!

บอกเลยว่านี่คือที่สุดของสมาร์ทโฟนจริงๆ ค่ะ! ในฐานะคนที่ชอบถ่ายรูปและจดโน้ตบ่อยๆ เจ้า S Pen เนี่ยคือเป็นมากกว่าปากกาจริงๆ นะ มันช่วยให้ชีวิตง่ายขึ้นเยอะมาก ทั้งสั่งถ่ายรูป แปลภาษา หรือแม้แต่แต่งรูปก็คือทำได้หมดเลย

เรื่องกล้องก็คือเทพสุดๆ! ถ่ายภาพสวยคมชัด เก็บรายละเอียดได้ครบทุกมุม ไม่ว่าจะถ่ายวิว ถ่ายคน หรือถ่ายอาหารก็คือสวยหมดเลย รู้สึกเหมือนมีกล้องโปรอยู่ในมือเลยค่ะ

ดีไซน์ก็สวยหรูดูแพง สี TITANIUM ก็คือดูดีมีระดับมากๆ จับแล้วรู้สึกพรีเมี่ยมสุดๆ

ข้อดีคือกล้องเทพ S Pen เจ๋ง ประสิทธิภาพแรงมาก ส่วนข้อสังเกตคือราคาก็เอาเรื่องอยู่เหมือนกัน แต่ถ้าคุณต้องการสมาร์ทโฟนที่ดีที่สุด ครบเครื่องที่สุด แนะนำตัวนี้เลย! ไม่ผิดหวังแน่นอน!",,0,1,24,1,0,0,0,0
1380064,1260018,0.0,"เครื่องฟอกอากาศ PHILIPS 25-78 ตร.ม. AC1715/21 White

โอยยยย! ใครเป็นภูมิแพ้แบบเรา ต้องมีสิ่งนี้ติดบ้านเลย! เครื่องฟอกอากาศ PHILIPS AC1715/21 เนี่ยคือช่วยชีวิตสุดๆ!

ปกติเป็นคนแพ้ฝุ่นง่ายมาก เวลาฝุ่นเยอะๆ จะจามทั้งวันเลย พอได้เครื่องนี้มาคือรู้สึกได้เลยว่าอากาศในห้องมันสะอาดขึ้นเยอะมากค่ะ หายใจโล่งขึ้นเยอะเลย ไม่ค่อยจามแล้วด้วย

แค่กดปุ่มเดียวมันก็กรองฝุ่น กรองไวรัส กรองสารก่อภูมิแพ้ได้หมดเลย คือเครื่องทำงานเร็วมาก CADR 300 ลบ.ม./ชม. นี่คือฟอกอากาศในห้องได้แป๊บเดียวก็สะอาดแล้วค่ะ กรองอนุภาคเล็กๆ ได้ถึง 0.003 ไมครอนเลยนะ คือดีงามมากๆ

ข้อดีคือฟอกอากาศได้ดีมาก หายใจสะดวกขึ้นเยอะ ใช้งานง่าย ส่วนข้อเสีย... ยังไม่เจอเลย! สำหรับสุขภาพปอดแล้ว ลงทุนกับเครื่องฟอกอากาศดีๆ สักเครื่องคือคุ้มค่ามากๆ เลย!",,0,1,24,1,0,0,0,0
1380065,1260018,0.0,"แท็บเล็ต Huawei MatePad SE 11 LTE (8+128) Nebula Gray (HMS)

สำหรับใครที่กำลังมองหาแท็บเล็ตคู่ใจที่ราคาเป็นมิตรแต่คุณภาพไม่เป็นรองใคร ขอแนะนำ Huawei MatePad SE 11 LTE ตัวนี้เลย!

ยอมรับว่าตอนแรกก็แอบลังเลนะ แต่พอได้ลองใช้จริงๆ คือมันเกินคาดมากเลยค่ะ! หน้าจอใหญ่สะใจมาก ดูหนัง ดูซีรีส์คือฟินสุดๆ แถมยังเป็นจอถนอมสายตาด้วยนะ ดูนานแค่ไหนก็ไม่ปวดตาเลย

ลำโพง 4 ตัวที่ให้มาก็คือเสียงดีมาก! กระหึ่มสุดๆ เหมือนมีโรงหนังส่วนตัวเลยก็ว่าได้ ส่วนแบตเตอรี่ก็คืออึดมาก! ใช้งานได้ทั้งวันแบบไม่ต้องกังวลเลยว่าจะแบตหมดระหว่างทาง

ข้อดีคือจอสวย ลำโพงดี แบตอึด ราคาดีงาม ส่วนข้อเสีย... สำหรับคนที่ไม่ได้ติด Google Services มากมาย ตัวนี้คือแท็บเล็ตที่คุ้มค่ามากๆ เลย!",,0,1,24,1,0,0,0,0
1380066,1260027,0.0,"แก้ว yeti สุด cool

วันนี้จะมารีวิวแก้วที่จริงใจ! แก้ว Yeti นั่นเอง! คือใครยังไม่มีต้องมีแล้วนะ!

แรกๆ ก็คิดว่าแก้วอะไรจะแพงขนาดนี้ แต่พอได้มาลองใช้เองเท่านั้นแหละค่ะ คือเข้าใจเลยว่าทำไมคนถึงฮิตกันนักหนา! มันเก็บความเย็นได้แบบข้ามวันข้ามคืนจริงๆ นะ ใส่ในน้ำแข็งไว้ตั้งแต่เช้า ตกเย็นน้ำแข็งยังอยู่เกือบเต็มแก้วเลยอ่ะ คือมัน Amazing มากจริงๆ!

ไม่ว่าจะอากาศร้อนแค่ไหน น้ำในแก้วก็ยังเย็นเจี๊ยบอยู่เลย พกไปไหนมาไหนก็คือสะดวกมาก ดีไซน์ก็คือเรียบง่ายแต่ดูดี มีหลายสีให้เลือกด้วยนะ

ข้อดีคือเก็บความเย็นได้โคตรดี ทนทานมากๆ ส่วนข้อเสีย... ราคาที่ทำให้ใจสั่นนิดหน่อย แต่ถ้าเทียบกับคุณภาพที่ได้คือคุ้มค่าทุกบาททุกสตางค์จริงๆ! ใครที่ชอบดื่มน้ำเย็นๆ ตลอดเวลา ต้องมีแก้ว Yeti ติดตัวไว้เลย! คอนเฟิร์ม!",,0,1,22,0,0,0,0,1
